university,year,section,section_title,text
Lakehead,1965,3,"Objects and purposes of University","The objects and purposes of the University are, (a) the advancement of learning and the dissemination of knowledge; and (b) the intellectual, social, moral and physical development of its members and the betterment of society."
Nipissing,1992,3,"Objects","The objects of the University are the pursuit of learning through scholarship, teaching and research within a spirit of free enquiry and expression."
Nipissing,1992,4,"Special mission","The University’s special mission is to be a teaching-oriented institution that offers programs in education and in liberal arts and science and programs that specifically address the needs of Northern Ontario."
York,1959,3,"Objects and purposes of University","The objects and purposes of the University are, (a) the advancement of learning and the dissemination of knowledge; and (b) the intellectual, social, moral and physical development of its members and the betterment of society."
York,1965,4,"Objects","The objects and purposes of the University are, (a) the advancement of learning and the dissemination of knowledge; and (b) the intellectual, spiritual, social, moral and physical development of its members and the betterment of society."
Brock,1964,3,"Objects and purposes of University","The objects and purposes of the University are, (a) the advancement of learning and the dissemination of knowledge; and (b) the intellectual, social, moral and physical development of its members and the betterment of society."
Carleton,1952,3,"Objects and purposes","The objects and purposes of the College are: (a) The advancement of learning. (b) The dissemination of knowledge. (c) The intellectual, social, moral and physical development of its members, and the betterment of its community. (d) The establishment and maintenance of a non-sectarian college with university powers, having its seat in or about the City of Ottawa."
Algoma,2008,3,"Objects","The objects of the University are the pursuit of learning through scholarship, teaching and research within a spirit of free enquiry and expression."
Algoma,2008,4,"Special mission","It is the special mission of the University to, (a) be a teaching-oriented university that provides programs in liberal arts and sciences and professional programs, primarily at the undergraduate level, with a particular focus on the needs of northern Ontario; and (b) cultivate cross-cultural learning between aboriginal communities and other communities, in keeping with the history of Algoma University College and its geographic site."